{
  "contractVersion": "1.0.0",
  "status": "OK",
  "presentationEnvelope": {
    "contractVersion": "1.0.0",
    "requestId": "11111111-1111-4111-8111-111111111111",
    "evidenceId": "aaaaaaaa-aaaa-4aaa-8aaa-aaaaaaaaaaaa",
    "evidenceHash": "sha256:0000000000000000000000000000000000000000000000000000000000000000",
    "presentationType": "KPI_CARD",
    "templateId": "forecast.kpi.v1",
    "channelProfile": "WEB_RICH_V1",
    "locale": "en-US",
    "title": "Forecast Accuracy",
    "subtitle": "Fiscal July 2026, Lag-0, Total scope",
    "data": { "metrics": [], "rows": [], "series": [] },
    "actions": [],
    "accessibility": { "summary": "Governed KPI.", "readingOrder": ["title", "value"] },
    "fallback": { "templateId": "forecast.text.v1", "text": "Forecast Accuracy: 39.6%." },
    "expiresAt": "2026-08-21T08:15:00Z",
    "reasonCode": "SCALAR_MATCH",
    "decision": {
      "candidateHint": "AUTO",
      "selectedType": "KPI_CARD",
      "templateId": "forecast.kpi.v1",
      "checks": [{ "check": "REGISTRY", "outcome": "PASS", "detail": "Registered template." }]
    },
    "events": [
      { "type": "presentation.status", "sequence": 1, "name": "READY", "status": "COMPLETED", "detail": "Ready." }
    ],
    "resourceReference": {
      "uri": "evidence://aaaaaaaa-aaaa-4aaa-8aaa-aaaaaaaaaaaa",
      "name": "Governed Forecast evidence aaaaaaaa",
      "mimeType": "application/json",
      "description": "User-scoped evidence metadata.",
      "audience": "USER_SCOPED"
    }
  },
  "trace": {
    "requestId": "11111111-1111-4111-8111-111111111111",
    "evidenceId": "aaaaaaaa-aaaa-4aaa-8aaa-aaaaaaaaaaaa",
    "reasonCode": "SCALAR_MATCH"
  },
  "events": [
    { "type": "presentation.status", "sequence": 1, "name": "READY", "status": "COMPLETED", "detail": "Ready." }
  ]
}
